{
  "authority": {
    "commit": "1745df89b608899f66983834fa4ec8c8910d18ff",
    "root": "authority/upstream/open-optimization-or-book-1745df89b608899f66983834fa4ec8c8910d18ff",
    "tree": "209d5de696ebac4e5921b73d6b6b2f539fc23d1c"
  },
  "inventory_assertions": {
    "instructional_notebook_networkx": 2,
    "operational_non_macro_xlsx": 19,
    "optimization_notebook_gurobi": 21,
    "optimization_notebook_pulp": 21,
    "submodule_archives": 3,
    "total_machine_witnesses": 63
  },
  "machine_witnesses": [
    {
      "authority_witness_target_presence": {
        "bytes": null,
        "path": "Intro-Math-Programming/baseText/optimization/optimization-examples/bakery_production_gurobi.ipynb",
        "present": false,
        "sha256": null
      },
      "bytes": 1195,
      "current_public_source_package_presence": {
        "authority_witness_path": "source/Intro-Math-Programming/baseText/optimization/optimization-examples/bakery_production_gurobi.ipynb",
        "authority_witness_present": false,
        "localized_derivative_path": null,
        "localized_derivative_present": false
      },
      "distribution_disposition": "authority_original_pruned_from_target_and_current_public_source_package; frozen_authority_only",
      "existing_backend_record": false,
      "format_classification": "jupyter_notebook_json",
      "id": "asset.r017.ch02.notebook.bakery-production.gurobi",
      "localized_derivative_target_presence": {
        "bytes": null,
        "path": null,
        "present": false,
        "sha256": null
      },
      "o018_pyomo_highs": {
        "disposition": "no_item_level_o018_pyomo_highs_mapping",
        "mapping_role": "r017_authority_witness_only",
        "mapping_unit_ids": [],
        "pyomo_highs_applicability": "not_mapped",
        "runtime_dependency_ids": [],
        "scope_note": "The current O018 inventory does not claim a Pyomo+HiGHS replacement for this exact witness; it remains frozen R017 authority evidence only."
      },
      "platform_classification": "python_notebook_requiring_proprietary_gurobi_runtime_and_license",
      "proprietary_runtime_required_for_r017_workflow": true,
      "rights_component_id": "rights.r017.code",
      "runtime_closure_disposition": "external_proprietary_runtime_not_shipped",
      "runtime_dependencies": [
        "Python",
        "Jupyter",
        "gurobipy/Gurobi"
      ],
      "runtime_dependency_ids": [
        "dependency.gurobi"
      ],
      "sha256": "8af36754a8b7e391e5b1eb93865d1bf28371a2d48981752074181e476e496ce3",
      "source_path": "Intro-Math-Programming/baseText/optimization/optimization-examples/bakery_production_gurobi.ipynb",
      "status": "authority_frozen_target_pruned",
      "target_path": null,
      "witness_kind": "optimization_notebook_gurobi"
    },
    {
      "authority_witness_target_presence": {
        "bytes": null,
        "path": "Intro-Math-Programming/baseText/optimization/optimization-examples/bakery_production_pulp.ipynb",
        "present": false,
        "sha256": null
      },
      "bytes": 1562,
      "current_public_source_package_presence": {
        "authority_witness_path": "source/Intro-Math-Programming/baseText/optimization/optimization-examples/bakery_production_pulp.ipynb",
        "authority_witness_present": false,
        "localized_derivative_path": null,
        "localized_derivative_present": false
      },
      "distribution_disposition": "authority_original_pruned_from_target_and_current_public_source_package; frozen_authority_only",
      "existing_backend_record": false,
      "format_classification": "jupyter_notebook_json",
      "id": "asset.r017.ch02.notebook.bakery-production.pulp",
      "localized_derivative_target_presence": {
        "bytes": null,
        "path": null,
        "present": false,
        "sha256": null
      },
      "o018_pyomo_highs": {
        "disposition": "no_item_level_o018_pyomo_highs_mapping",
        "mapping_role": "r017_authority_witness_only",
        "mapping_unit_ids": [],
        "pyomo_highs_applicability": "not_mapped",
        "runtime_dependency_ids": [],
        "scope_note": "The current O018 inventory does not claim a Pyomo+HiGHS replacement for this exact witness; it remains frozen R017 authority evidence only."
      },
      "platform_classification": "open_source_python_pulp_solver_workflow",
      "proprietary_runtime_required_for_r017_workflow": false,
      "rights_component_id": "rights.r017.code",
      "runtime_closure_disposition": "external_runtime_not_frozen_or_shipped_for_this_witness",
      "runtime_dependencies": [
        "Python",
        "Jupyter",
        "PuLP",
        "PuLP solver backend"
      ],
      "runtime_dependency_ids": [],
      "sha256": "ac96d8a88ac4c8746300a809407f624e1e3c1938252f0aa6dd735b54a9e856ae",
      "source_path": "Intro-Math-Programming/baseText/optimization/optimization-examples/bakery_production_pulp.ipynb",
      "status": "authority_frozen_target_pruned",
      "target_path": null,
      "witness_kind": "optimization_notebook_pulp"
    },
    {
      "authority_witness_target_presence": {
        "bytes": null,
        "path": "Intro-Math-Programming/baseText/optimization/optimization-examples/diet_problem_next_gurobi.ipynb",
        "present": false,
        "sha256": null
      },
      "bytes": 3384,
      "current_public_source_package_presence": {
        "authority_witness_path": "source/Intro-Math-Programming/baseText/optimization/optimization-examples/diet_problem_next_gurobi.ipynb",
        "authority_witness_present": false,
        "localized_derivative_path": null,
        "localized_derivative_present": false
      },
      "distribution_disposition": "authority_original_pruned_from_target_and_current_public_source_package; frozen_authority_only",
      "existing_backend_record": false,
      "format_classification": "jupyter_notebook_json",
      "id": "asset.r017.ch02.notebook.diet-problem-next.gurobi",
      "localized_derivative_target_presence": {
        "bytes": null,
        "path": null,
        "present": false,
        "sha256": null
      },
      "o018_pyomo_highs": {
        "disposition": "no_item_level_o018_pyomo_highs_mapping",
        "mapping_role": "r017_authority_witness_only",
        "mapping_unit_ids": [],
        "pyomo_highs_applicability": "not_mapped",
        "runtime_dependency_ids": [],
        "scope_note": "The current O018 inventory does not claim a Pyomo+HiGHS replacement for this exact witness; it remains frozen R017 authority evidence only."
      },
      "platform_classification": "python_notebook_requiring_proprietary_gurobi_runtime_and_license",
      "proprietary_runtime_required_for_r017_workflow": true,
      "rights_component_id": "rights.r017.code",
      "runtime_closure_disposition": "external_proprietary_runtime_not_shipped",
      "runtime_dependencies": [
        "Python",
        "Jupyter",
        "gurobipy/Gurobi"
      ],
      "runtime_dependency_ids": [
        "dependency.gurobi"
      ],
      "sha256": "637cda37ae7d021c6f2a9bc7f08415fee2c5dbfcf8f8028c220ba087ebdb37e0",
      "source_path": "Intro-Math-Programming/baseText/optimization/optimization-examples/diet_problem_next_gurobi.ipynb",
      "status": "authority_frozen_target_pruned",
      "target_path": null,
      "witness_kind": "optimization_notebook_gurobi"
    },
    {
      "authority_witness_target_presence": {
        "bytes": null,
        "path": "Intro-Math-Programming/baseText/optimization/optimization-examples/diet_problem_next_pulp.ipynb",
        "present": false,
        "sha256": null
      },
      "bytes": 3086,
      "current_public_source_package_presence": {
        "authority_witness_path": "source/Intro-Math-Programming/baseText/optimization/optimization-examples/diet_problem_next_pulp.ipynb",
        "authority_witness_present": false,
        "localized_derivative_path": null,
        "localized_derivative_present": false
      },
      "distribution_disposition": "authority_original_pruned_from_target_and_current_public_source_package; frozen_authority_only",
      "existing_backend_record": false,
      "format_classification": "jupyter_notebook_json",
      "id": "asset.r017.ch02.notebook.diet-problem-next.pulp",
      "localized_derivative_target_presence": {
        "bytes": null,
        "path": null,
        "present": false,
        "sha256": null
      },
      "o018_pyomo_highs": {
        "disposition": "no_item_level_o018_pyomo_highs_mapping",
        "mapping_role": "r017_authority_witness_only",
        "mapping_unit_ids": [],
        "pyomo_highs_applicability": "not_mapped",
        "runtime_dependency_ids": [],
        "scope_note": "The current O018 inventory does not claim a Pyomo+HiGHS replacement for this exact witness; it remains frozen R017 authority evidence only."
      },
      "platform_classification": "open_source_python_pulp_solver_workflow",
      "proprietary_runtime_required_for_r017_workflow": false,
      "rights_component_id": "rights.r017.code",
      "runtime_closure_disposition": "external_runtime_not_frozen_or_shipped_for_this_witness",
      "runtime_dependencies": [
        "Python",
        "Jupyter",
        "PuLP",
        "PuLP solver backend"
      ],
      "runtime_dependency_ids": [],
      "sha256": "07e7c2c6e92307a9aa84d37879119b247587ce741782d703748d428d7f6c372a",
      "source_path": "Intro-Math-Programming/baseText/optimization/optimization-examples/diet_problem_next_pulp.ipynb",
      "status": "authority_frozen_target_pruned",
      "target_path": null,
      "witness_kind": "optimization_notebook_pulp"
    },
    {
      "authority_witness_target_presence": {
        "bytes": null,
        "path": "Intro-Math-Programming/baseText/optimization/optimization-examples/diet_problem_gurobi.ipynb",
        "present": false,
        "sha256": null
      },
      "bytes": 4139,
      "current_public_source_package_presence": {